{
  "$schema": "https://json-schema.org/draft/2020-12/schema",
  "$id": "https://ai-testing-tool.local/schemas/ingest-payload.schema.json",
  "title": "AiTestingTool ingest payload (FR41)",
  "type": "object",
  "required": ["projectKey", "report"],
  "additionalProperties": true,
  "properties": {
    "projectKey": { "type": "string", "minLength": 1 },
    "launchName": { "type": "string" },
    "format": {
      "type": "string",
      "enum": ["jest-json", "vitest-json", "normalized"],
      "description": "jest-json / vitest-json / normalized"
    },
    "ciPlatform": { "type": "string" },
    "ciBuildUrl": { "type": "string" },
    "gitCommitSha": { "type": "string" },
    "gitBranch": { "type": "string" },
    "gitAuthorName": { "type": "string" },
    "gitHashCommitUrl": { "type": "string" },
    "ciTriggeredBy": { "type": "string" },
    "gitCommittedAt": { "type": "string" },
    "gitCommitMessageSubject": { "type": "string" },
    "gitCommitMessageBody": { "type": "string" },
    "report": {
      "description": "Jest/Vitest JSON report object",
      "type": "object",
      "required": ["testResults"],
      "properties": {
        "numTotalTests": { "type": "number" },
        "numPassedTests": { "type": "number" },
        "numFailedTests": { "type": "number" },
        "numPendingTests": { "type": "number" },
        "numTodoTests": { "type": "number" },
        "startTime": { "type": "number" },
        "success": { "type": "boolean" },
        "testResults": {
          "type": "array",
          "items": {
            "type": "object",
            "properties": {
              "name": { "type": "string" },
              "status": { "type": "string" },
              "assertionResults": {
                "type": "array",
                "items": {
                  "type": "object",
                  "properties": {
                    "title": { "type": "string" },
                    "fullName": { "type": "string" },
                    "status": { "type": "string" },
                    "meta": {
                      "type": "object",
                      "description": "Optional extensions; meta.qa carries reporter-rich metadata (FR41). Prefer meta.qa.issueKeys for FR43 over embedding keys in titles.",
                      "properties": {
                        "qa": {
                          "type": "object",
                          "description": "Serialized QA metadata: suite, issueKeys, fields, steps, comments, attachments",
                          "properties": {
                            "issueKeys": {
                              "type": "array",
                              "items": { "type": "string" },
                              "description": "Explicit Jira issue keys (FR43). Roles classified via TMS type map. Required for linking — titles are not scraped."
                            }
                          },
                          "additionalProperties": true
                        }
                      },
                      "additionalProperties": true
                    }
                  },
                  "additionalProperties": true
                }
              }
            },
            "additionalProperties": true
          }
        }
      }
    },
    "tests": {
      "type": "array",
      "description": "Optional normalized shape when format=normalized"
    }
  }
}
